{
  "schema_version": "1.0.0",
  "record_type": "teaching",
  "record_kind": "live",
  "assessment_mode": "mixed",
  "topic_selection": "learner_approval",
  "hint_order": [
    "guiding_question",
    "specific_hint",
    "partial_example",
    "full_explanation"
  ],
  "explanation_on_request": true,
  "new_task_after_explanation": true,
  "independent_tasks": {
    "allowed_resources": [
      "ide",
      "tests",
      "documentation"
    ],
    "llm_hints": false
  },
  "session_rules": {
    "flexible_time_allocation": true,
    "closure_command": "kończymy",
    "carry_unfinished_work": true
  },
  "source_rules": [
    "Use the repository for approved learner facts and teaching rules.",
    "Use the Java Language Specification and Java Virtual Machine Specification for language and JVM requirements.",
    "Use Java API documentation for library contracts. Use OpenJDK sources for implementation details.",
    "Separate specification requirements from HotSpot behavior. State the JDK version when behavior can differ.",
    "Check sources before a claim about a version change. Give the source URL and access date in the lesson.",
    "If a source is unavailable, state the uncertainty. Do not invent a citation."
  ],
  "evidence_rules": [
    "Start with a short initial assessment. Assess each selected topic again before new instruction.",
    "Ask one question at a time. Wait for the answer before you assess it.",
    "Ask the learner to predict behavior, explain the mechanism, and test a small program.",
    "Use the hint order. Stop when the learner can continue. Give a full explanation when the learner asks for it.",
    "After an explanation, use a new task to check independent understanding.",
    "Ask the learner to recall earlier work before you show the answer.",
    "Propose later reviews from observed results. Agree on dates instead of using an assumed fixed interval.",
    "Do not infer skill from years of work. Do not treat confidence or recognition as evidence of independent use.",
    "Record the task, observed result, help level, and source of each observation.",
    "Keep tutor assessments separate from observations. State uncertainty when the evidence is incomplete.",
    "Use applied_independently only after an explanation of the mechanism and a new solution without LLM hints.",
    "Use retained only after an independent check on a later day. Link the earlier independent evidence.",
    "Use learner_report for results supplied by the learner. Use agent_execution only for results from an execution tool.",
    "Use not_run when execution did not occur. Code review is not execution.",
    "Do not invent elapsed time. Use actual_minutes as null when it is unknown.",
    "Keep all exercises within the session. Carry unfinished work into a proposed next session."
  ],
  "approval_rules": [
    "Propose a topic and explain the reason. Let the learner accept, replace, or defer it.",
    "When the learner says kończymy, stop new instruction and prepare the review.",
    "Present the lesson summary and all proposed state changes in Polish.",
    "Show tasks, results, help, errors, assessments, open work, sources, and the proposed next step.",
    "Ask for approval of the final content. A topic choice does not approve a lesson record.",
    "Save only the approved meaning. If a later edit changes meaning, ask for new approval.",
    "Save one lesson file and related changes in one commit on develop. Do not create a pull request.",
    "If the chat ends before approval, use the last approved state in the next chat.",
    "After each commit, check the required jobs for its exact SHA. Report failed, pending, and unavailable results."
  ]
}
